{
  "equipment_id": "00000000-0000-4000-8000-000000000007",
  "assignment_id": "00000000-0000-4000-8000-000000000014",
  "unsubmitted_captures": [
    {
      "panel_id": "00000000-0000-4000-8000-000000000015",
      "frames": 12,
      "integration_seconds": 3600,
      "last_captured_at": "2026-10-04T04:55:00Z"
    }
  ],
  "observed_at": "2026-10-04T05:00:00Z"
}
